{"account_result":{"affected_order_hashes":[],"applied_batch_ids":[],"code":"UNSETTLED_HOLD","committed_fill_ids":[],"corrected_fill_ids":[],"created_fill_ids":[],"kind":"WITHDRAW_PREPARE","ledger_changes":[],"observed_height":"100","request_hash":"2931b6e48caa15a12a9b08f825f77fa2de3264beb49d04668fd982446f181522","snapshot_id":"659a8e723acf843d882f2302cf319003c09c62bf3dc9ea85cb05bd4f29adec7d","state":"REJECTED"},"context":{"chain_id":"nus-s3-dev-1","config_hash":"3f191ced0b17538b4f755c4beda0859c00bfc41a325d5d581518eb23d7c18f41","contract_hash":"a78911795ea2ce9ef532c72d9d978ac608259a8b46d68cc5cbb1de88a51fb33e","genesis_hash":"fbf4c612dce2960416188301de5413e9804d5d530b94d588ab1adefe7896d27c","market_config_version":"1","market_id":"DEVBASE/DEVQUOTE","service_schema":"s3/3"},"development_receipt":"LOCAL_WRITE_COMPLETED_UNPROVEN_SPACE","durable_ack":false,"envelope_version":"s3-dev-local-account/1","principal":"oIaWES+LNih3s7qlJGBQntJ0Cx4=","profile_id":"s3-dev-local-v1","source":{"after_state_hash":"b70c727c92014e9feb2d8255d87e7199a5fd03aa916fa94a28cc3c7e23c22fcb","command_result_hash":"68a7cf05e41440a58fcfeb1878fa3b597c362b742f3d2901b453e7c120fe91d7","command_seq":"3","record_hash":"e55d28f5456d7c37668b32a604df4e1c76d6fee559d5dc79731b264708a33302"},"storage_assurance":"UNPROVEN_HOST_SPACE"}