{"account_result":{"affected_order_hashes":["eac83c345a612d5db8e491d22e71d20967a235bfbda8cf71492b044540bd704c"],"applied_batch_ids":[],"code":"OK","committed_fill_ids":[],"corrected_fill_ids":[],"created_fill_ids":[],"kind":"CANCEL","ledger_changes":[],"observed_height":"100","request_hash":"2d6c216ab1086420f0aaed3af6e111881becd9bbfb6e97eac9a6c3cbf20084f0","snapshot_id":"659a8e723acf843d882f2302cf319003c09c62bf3dc9ea85cb05bd4f29adec7d","state":"LOCAL_ACCEPTED"},"context":{"chain_id":"nus-s3-dev-1","config_hash":"3f191ced0b17538b4f755c4beda0859c00bfc41a325d5d581518eb23d7c18f41","contract_hash":"a78911795ea2ce9ef532c72d9d978ac608259a8b46d68cc5cbb1de88a51fb33e","genesis_hash":"fbf4c612dce2960416188301de5413e9804d5d530b94d588ab1adefe7896d27c","market_config_version":"1","market_id":"DEVBASE/DEVQUOTE","service_schema":"s3/3"},"development_receipt":"LOCAL_WRITE_COMPLETED_UNPROVEN_SPACE","durable_ack":false,"envelope_version":"s3-dev-local-account/1","principal":"oIaWES+LNih3s7qlJGBQntJ0Cx4=","profile_id":"s3-dev-local-v1","source":{"after_state_hash":"bb08fb900e6f72b50e8da632332a672414fc05ef0247f9cdca935df766c8897e","command_result_hash":"5206db7eb0f20e8d4cc44935d618746b7d827261bbedd1f66d6439132e46535a","command_seq":"3","record_hash":"5c472e3b97e373e9d9036ceb4c0ad71beb5403c3fd39ece536faac14b466b606"},"storage_assurance":"UNPROVEN_HOST_SPACE"}