{"account_result":{"affected_order_hashes":[],"applied_batch_ids":[],"code":"OK","committed_fill_ids":["be24574daff3b8040a88dd43f5baf09fcf0ec1db017e1ef4dcea7c2b9cdd42a7"],"corrected_fill_ids":[],"created_fill_ids":[],"kind":"SETTLEMENT_APPLY","ledger_changes":[{"after":{"A":"0","C":"0","D":"0","P":"997500","R":"0","denom":"DEVBASE"},"before":{"A":"0","C":"0","D":"0","P":"0","R":"0","denom":"DEVBASE"},"owner":"oIaWES+LNih3s7qlJGBQntJ0Cx4="},{"after":{"A":"88000000","C":"100000000","D":"12000000","P":"0","R":"0","denom":"DEVQUOTE"},"before":{"A":"100000000","C":"100000000","D":"0","P":"0","R":"0","denom":"DEVQUOTE"},"owner":"oIaWES+LNih3s7qlJGBQntJ0Cx4="}],"observed_height":"100","request_hash":"d05faa951e7fad17dab5a2c0a55327ace5ada5477400580da8e3993891554999","snapshot_id":"bb7457e36aa2ebfd72b1d9bca617188e69a19b8b6172c36c0414390f7dcd36e7","state":"LOCAL_ACCEPTED"},"context":{"chain_id":"nus-s3-dev-1","config_hash":"8719f0dcacb18268f55947afaf5d0e6fa0ea2d698509930b55925b492bb85fa1","contract_hash":"a78911795ea2ce9ef532c72d9d978ac608259a8b46d68cc5cbb1de88a51fb33e","genesis_hash":"a3413978fca4aa956e4bcf2105344048c7da0e22db70e3e87a59e4c42aad13e2","market_config_version":"1","market_id":"DEVBASE/DEVQUOTE","service_schema":"s3/3"},"development_receipt":"LOCAL_WRITE_COMPLETED_UNPROVEN_SPACE","durable_ack":false,"envelope_version":"s3-dev-local-account/1","principal":"oIaWES+LNih3s7qlJGBQntJ0Cx4=","profile_id":"s3-dev-local-v1","source":{"after_state_hash":"7fcb2fddf9c402a325e936bcc64d37d741b45c0eebf530baf33cd299b6b9c574","command_result_hash":"7f357d0f422d7e9d8406d02912fd1c39194a1c481d3f8898317de7b311935870","command_seq":"2","record_hash":"840b8c1613593bb2e2382644367a1a5505101983f58f47b6f6e86a4096a7f364"},"storage_assurance":"UNPROVEN_HOST_SPACE"}