{"account_result":{"affected_order_hashes":[],"applied_batch_ids":[],"code":"INSUFFICIENT_AVAILABLE","committed_fill_ids":[],"corrected_fill_ids":[],"created_fill_ids":[],"kind":"ORDER","ledger_changes":[],"observed_height":"100","request_hash":"fd69286e6ac564a7cc5a0540db49611230229f4fe66b03dcf0b1b546fdf4f747","snapshot_id":"659a8e723acf843d882f2302cf319003c09c62bf3dc9ea85cb05bd4f29adec7d","state":"REJECTED"},"context":{"chain_id":"nus-s3-dev-1","config_hash":"3f191ced0b17538b4f755c4beda0859c00bfc41a325d5d581518eb23d7c18f41","contract_hash":"a78911795ea2ce9ef532c72d9d978ac608259a8b46d68cc5cbb1de88a51fb33e","genesis_hash":"fbf4c612dce2960416188301de5413e9804d5d530b94d588ab1adefe7896d27c","market_config_version":"1","market_id":"DEVBASE/DEVQUOTE","service_schema":"s3/3"},"development_receipt":"LOCAL_WRITE_COMPLETED_UNPROVEN_SPACE","durable_ack":false,"envelope_version":"s3-dev-local-account/1","principal":"oIaWES+LNih3s7qlJGBQntJ0Cx4=","profile_id":"s3-dev-local-v1","source":{"after_state_hash":"9de5cd1e0b472ea7fa24748840971f3a7a5ccef28f729280ddb9b34c0a644c07","command_result_hash":"e25264057091a7b1c29b3a7185db90f302703d3d205bad750a54f0f99a9d39a4","command_seq":"3","record_hash":"950b2213226d2c68573cfd3493325541f13b2c19b405d880e88c4841050276ad"},"storage_assurance":"UNPROVEN_HOST_SPACE"}