{"account_result":{"affected_order_hashes":["eac83c345a612d5db8e491d22e71d20967a235bfbda8cf71492b044540bd704c"],"applied_batch_ids":[],"code":"OK","committed_fill_ids":[],"corrected_fill_ids":[],"created_fill_ids":["be24574daff3b8040a88dd43f5baf09fcf0ec1db017e1ef4dcea7c2b9cdd42a7"],"kind":"ORDER","ledger_changes":[{"after":{"A":"0","C":"0","D":"0","P":"1000000","R":"0","denom":"DEVBASE"},"before":{"A":"0","C":"0","D":"0","P":"0","R":"0","denom":"DEVBASE"},"owner":"oIaWES+LNih3s7qlJGBQntJ0Cx4="},{"after":{"A":"88000000","C":"100000000","D":"12000000","P":"0","R":"0","denom":"DEVQUOTE"},"before":{"A":"100000000","C":"100000000","D":"0","P":"0","R":"0","denom":"DEVQUOTE"},"owner":"oIaWES+LNih3s7qlJGBQntJ0Cx4="}],"observed_height":"100","request_hash":"eac83c345a612d5db8e491d22e71d20967a235bfbda8cf71492b044540bd704c","snapshot_id":"659a8e723acf843d882f2302cf319003c09c62bf3dc9ea85cb05bd4f29adec7d","state":"LOCAL_ACCEPTED"},"context":{"chain_id":"nus-s3-dev-1","config_hash":"3f191ced0b17538b4f755c4beda0859c00bfc41a325d5d581518eb23d7c18f41","contract_hash":"a78911795ea2ce9ef532c72d9d978ac608259a8b46d68cc5cbb1de88a51fb33e","genesis_hash":"fbf4c612dce2960416188301de5413e9804d5d530b94d588ab1adefe7896d27c","market_config_version":"1","market_id":"DEVBASE/DEVQUOTE","service_schema":"s3/3"},"development_receipt":"LOCAL_WRITE_COMPLETED_UNPROVEN_SPACE","durable_ack":false,"envelope_version":"s3-dev-local-account/1","principal":"oIaWES+LNih3s7qlJGBQntJ0Cx4=","profile_id":"s3-dev-local-v1","source":{"after_state_hash":"5b383864d05b9316169f14427c74d8aea2f93b5e71d326a2fb5ea91b716c0ae6","command_result_hash":"1f9617615e12e9e4ee69cad66ef3837c295ca1f3792578f58571bdaa576e74c1","command_seq":"2","record_hash":"484e9acb1832f1a3d9375b65a69be589b87db3eb101abc64f7ad74ea7dae5e4b"},"storage_assurance":"UNPROVEN_HOST_SPACE"}