{"account_result":{"affected_order_hashes":["f62ffe4433c6e9c33a86b63d231cbd96d95b8d2076a7ed903addb1cb39c0d990"],"applied_batch_ids":["b459afddb3a09621ee29b78b3968e566d7fb0001d96395d54030eb703b0337a9"],"code":"OK","committed_fill_ids":[],"corrected_fill_ids":["fe8ed292e6c72e71219dcade142a7ef0eeb519038361976eab53b2a9768d2ca2"],"created_fill_ids":[],"kind":"CORRECTION","ledger_changes":[{"after":{"A":"1000000000000","C":"1000000000000","D":"0","P":"0","R":"0","denom":"DEVBASE"},"before":{"A":"999000000000","C":"1000000000000","D":"1000000000","P":"0","R":"0","denom":"DEVBASE"},"owner":"APcdh4pZRaEIcCfVQJaJx0+a8V8="},{"after":{"A":"1000000000000","C":"1000000000000","D":"0","P":"0","R":"0","denom":"DEVQUOTE"},"before":{"A":"1000000000000","C":"1000000000000","D":"0","P":"1000000000000","R":"0","denom":"DEVQUOTE"},"owner":"APcdh4pZRaEIcCfVQJaJx0+a8V8="}],"observed_height":"202","request_hash":"e0bc1e66eb35f8e5fb99bc6e8d13ab08330c9d53ca47e2871edf8f8b7051a09f","snapshot_id":"547cb4b55f4486ff482f8dd754faeec8984678cd343a536e69c91d8d57c42e84","state":"LOCAL_ACCEPTED"},"context":{"chain_id":"nus-s3-dev-1","config_hash":"734e51d9293873b8e6fdae201881bdb71a0fc7442416d46f00fd1ccd8cce3203","contract_hash":"1111111111111111111111111111111111111111111111111111111111111111","genesis_hash":"6f77332ec4a26f1dee0e45cd711b4c077b0e5e586d4fef0cab9b19e097c921d5","market_config_version":"1","market_id":"DEVBASE/DEVQUOTE","service_schema":"s3/3"},"development_receipt":"LOCAL_WRITE_COMPLETED_UNPROVEN_SPACE","durable_ack":false,"envelope_version":"s3-dev-local-account/1","principal":"APcdh4pZRaEIcCfVQJaJx0+a8V8=","profile_id":"s3-dev-local-v1","source":{"after_state_hash":"77522b86e769667fbe4414d89970cd51d93423e9156eac6c99a2c0ef48671355","command_result_hash":"52b1da1ff1ef0ce3d89cc156cd138270b850bdb8659c709cac627eebff2911a3","command_seq":"6","record_hash":"af5f0d5adfeb34f951ae40e7aed8fb5988ba8df04cfe279b103961b9a253ae6d"},"storage_assurance":"UNPROVEN_HOST_SPACE"}