{"account_result":{"affected_order_hashes":["fc20293ac760145bf278931ad3aab8fa39f2038dcc134a61b3daeee17c03c285"],"applied_batch_ids":[],"code":"OK","committed_fill_ids":[],"corrected_fill_ids":[],"created_fill_ids":[],"kind":"ORDER","ledger_changes":[{"after":{"A":"8000000","C":"10000000","D":"0","P":"0","R":"2000000","denom":"DEVBASE"},"before":{"A":"10000000","C":"10000000","D":"0","P":"0","R":"0","denom":"DEVBASE"},"owner":"ZBHy+zsA/eQg30bQEWhTLER14As="}],"observed_height":"100","request_hash":"fc20293ac760145bf278931ad3aab8fa39f2038dcc134a61b3daeee17c03c285","snapshot_id":"659a8e723acf843d882f2302cf319003c09c62bf3dc9ea85cb05bd4f29adec7d","state":"LOCAL_ACCEPTED"},"context":{"chain_id":"nus-s3-dev-1","config_hash":"3f191ced0b17538b4f755c4beda0859c00bfc41a325d5d581518eb23d7c18f41","contract_hash":"a78911795ea2ce9ef532c72d9d978ac608259a8b46d68cc5cbb1de88a51fb33e","genesis_hash":"fbf4c612dce2960416188301de5413e9804d5d530b94d588ab1adefe7896d27c","market_config_version":"1","market_id":"DEVBASE/DEVQUOTE","service_schema":"s3/3"},"development_receipt":"LOCAL_WRITE_COMPLETED_UNPROVEN_SPACE","durable_ack":false,"envelope_version":"s3-dev-local-account/1","principal":"ZBHy+zsA/eQg30bQEWhTLER14As=","profile_id":"s3-dev-local-v1","source":{"after_state_hash":"f54a22eb596462fcc7a79a156317ab6454e22c5f629e76887d67223722d2a961","command_result_hash":"9e8c109ea1918c40117bf708c250f863df47f19f4c35ed3b653488fa30579f9c","command_seq":"1","record_hash":"7a677f53c35f606ace69e9d7eaef3b00a1d8c6a5807c3cf37374f0f769d49277"},"storage_assurance":"UNPROVEN_HOST_SPACE"}